{"episode":{"episode_id":"NousResearch__hermes-agent__64178__8be9c76f","title":"Make callback delivery lazy-safe and force reload lifecycle-symmetric","before":"At parent eac1e25127a75c61116a0bbb8ce7681a2f8b61b4, module-level hook and middleware invocation and presence checks directly queried the process plugin manager without ensuring discovery. Processes that did not import the component whose side effect triggered discovery could therefore report no callback or silently skip delivery. Separately, full unload cleared manager-local hooks without restoring configuration-owned shell hooks, and it removed legacy platform registrations but did not deregister tool names tracked outside the ownership ledger, allowing missing configuration hooks and stale global tools after force reload.","after":"At 8be9c76f8c01f652e1c7acd576c37e4bdaed30be, callback delivery entry points obtain a delivery manager that joins in-flight background discovery and performs discovery when necessary while preserving compatibility with manager test doubles. Full unload also deregisters tracked tool names not represented by tool ownership records. After a successful forced discovery sweep, configuration-owned shell hooks are rebuilt from current configuration; restoration failures are logged and do not invalidate the completed reload.","diff":"The change adds a lazy-discovery delivery helper and routes module-level invoke_hook, invoke_middleware, has_hook, and has_middleware through it; adds a legacy-tool cleanup sweep during unload-all while excluding ownership-ledger tools; adds configuration-hook re-registration that resets registration idempotence and reloads configuration; invokes that reconciliation only after successful force rediscovery; and adds focused tests for lazy delivery, gate behavior, mock-manager compatibility, shell-hook restoration, fail-open restoration, and stale-tool cleanup. The commit modifies agent/shell_hooks.py, hermes_cli/plugins.py, and tests/hermes_cli/test_plugins.py with 282 insertions and 5 deletions."},"evidence_units":[{"id":"ev-commit-01","kind":"commit","claim":"Commit 8be9c76f8c01f652e1c7acd576c37e4bdaed30be has parent eac1e25127a75c61116a0bbb8ce7681a2f8b61b4 and is titled \"fix(plugins): hook delivery parity + symmetric force-reload (#64178)\".","source":"git show --format=fuller 8be9c76f8c01f652e1c7acd576c37e4bdaed30be; issue-bundle.json resolved_commit and parent_commit"},{"id":"ev-diff-01","kind":"diff","claim":"The pinned change modifies three implementation/test files with 282 insertions and 5 deletions.","source":"git show --stat 8be9c76f8c01f652e1c7acd576c37e4bdaed30be"},{"id":"ev-before-01","kind":"diff","claim":"In the parent, module-level invoke_hook and invoke_middleware directly used get_plugin_manager(), has_hook directly queried that manager, and has_middleware inspected the undiscovered manager without initiating discovery.","source":"git diff eac1e25127a75c61116a0bbb8ce7681a2f8b61b4 8be9c76f8c01f652e1c7acd576c37e4bdaed30be -- hermes_cli/plugins.py; parent hermes_cli/plugins.py around former lines 5234-5268"},{"id":"ev-impl-01","kind":"implementation","claim":"_delivery_manager obtains the active manager, treats managers without _discovered as already usable, joins background discovery when the real manager is undiscovered, invokes discover_and_load, and returns the resulting manager.","source":"8be9c76f8c01f652e1c7acd576c37e4bdaed30be:hermes_cli/plugins.py:5284-5301"},{"id":"ev-impl-02","kind":"implementation","claim":"Module-level hook and middleware invocation and presence-gate functions now ensure discovery through _delivery_manager before dispatching or deciding that callbacks are absent.","source":"8be9c76f8c01f652e1c7acd576c37e4bdaed30be:hermes_cli/plugins.py:5304-5357"},{"id":"ev-callsite-01","kind":"call_site","claim":"A lifecycle producer checks has_hook before calling invoke_hook, demonstrating that an incorrect pre-discovery false result can suppress callback delivery entirely.","source":"8be9c76f8c01f652e1c7acd576c37e4bdaed30be:tools/skill_usage.py:826-832"},{"id":"ev-test-01","kind":"test","claim":"Delivery-parity tests construct an undiscovered manager and verify that module-level hook invocation, middleware invocation, and both presence gates trigger discovery and observe registered callbacks; another test verifies compatibility with a stub manager lacking _discovered.","source":"8be9c76f8c01f652e1c7acd576c37e4bdaed30be:tests/hermes_cli/test_plugins.py:540-618"},{"id":"ev-before-02","kind":"diff","claim":"The parent unload-all path swept legacy platform names and cleared manager-local tool tracking, but contained no corresponding global deregistration sweep for tool names lacking ownership-ledger registrations.","source":"git diff eac1e25127a75c61116a0bbb8ce7681a2f8b61b4 8be9c76f8c01f652e1c7acd576c37e4bdaed30be -- hermes_cli/plugins.py; parent hermes_cli/plugins.py around former lines 3289-3324"},{"id":"ev-impl-03","kind":"implementation","claim":"During unload-all, the implementation derives tool names covered by ownership records, selects tracked names outside that set, and best-effort deregisters only those legacy names from the process-global tool registry before clearing manager state.","source":"8be9c76f8c01f652e1c7acd576c37e4bdaed30be:hermes_cli/plugins.py:3312-3345"},{"id":"ev-test-02","kind":"test","claim":"A force-reload test places a tool name in manager tracking without an ownership record, calls unload, and asserts that the global deregistration operation received that name and that local tracking and discovery state were reset.","source":"8be9c76f8c01f652e1c7acd576c37e4bdaed30be:tests/hermes_cli/test_plugins.py:650-670"},{"id":"ev-before-03","kind":"diff","claim":"Force discovery already called unload, whose unload-all branch clears the manager's hook dictionary, but the parent had no post-discovery operation to reconstruct configuration-owned shell hooks.","source":"git diff eac1e25127a75c61116a0bbb8ce7681a2f8b61b4 8be9c76f8c01f652e1c7acd576c37e4bdaed30be -- hermes_cli/plugins.py agent/shell_hooks.py; parent hermes_cli/plugins.py around former lines 3309-3424"},{"id":"ev-impl-04","kind":"implementation","claim":"re_register_config_hooks clears the shell-hook idempotence set under its lock, loads current configuration, and passes it through the existing registration routine.","source":"8be9c76f8c01f652e1c7acd576c37e4bdaed30be:agent/shell_hooks.py:335-355"},{"id":"ev-impl-05","kind":"implementation","claim":"After a successful forced discovery sweep, discover_and_load invokes shell-hook reconciliation. The adapter catches ordinary restoration errors and logs them so an otherwise successful force reload remains discovered.","source":"8be9c76f8c01f652e1c7acd576c37e4bdaed30be:hermes_cli/plugins.py:3395-3443"},{"id":"ev-test-03","kind":"test","claim":"Force-reload tests verify that shell-hook reconciliation is not called for initial discovery, is called once for force discovery, and that a reconciliation exception does not prevent the manager from reaching discovered state.","source":"8be9c76f8c01f652e1c7acd576c37e4bdaed30be:tests/hermes_cli/test_plugins.py:621-648"},{"id":"ev-test-04","kind":"test","claim":"The shell-hook helper test verifies that re-registration clears the prior idempotence key and supplies freshly loaded configuration to the existing registration routine.","source":"8be9c76f8c01f652e1c7acd576c37e4bdaed30be:tests/hermes_cli/test_plugins.py:672-691"},{"id":"ev-bundle-01","kind":"validation","claim":"The supplied evidence bundle classifies the pinned artifact as a training candidate with a resolved local implementation commit and implementation-plus-test changes, while explicitly noting that GitHub discussion metadata is unavailable.","source":"/home/chenyujia/tritonToLlvm/arex-skill-graph/data/skill-extraction/agent-core-thirteen-category-extraction-v2/codex-5.6-sol-contract-v2-20261001/16-extension-lifecycle-and-reload/NousResearch__hermes-agent__64178/issue-bundle.json"}],"candidate_atomics":[{"name":"ensure-discovery-before-callback-delivery","title":"Discover extensions before checking or delivering callbacks","description":"At callback-facing entry points, wait for any ongoing discovery and lazily discover extensions before invoking hooks or middleware or using their presence as a delivery gate.","evidence_ids":["ev-before-01","ev-impl-01","ev-impl-02","ev-callsite-01","ev-test-01"],"semantic_action":{"intent":"Prevent extension callbacks from being silently absent in processes whose startup path did not explicitly trigger extension discovery.","module_role":"callback delivery boundary","operation":"guard","pre_state":"A callback invocation or presence check reaches an extension manager whose discovery sweep may not have run or may still be running.","post_state":"The real manager has completed discovery before callback lookup or dispatch, while injected manager substitutes without lifecycle state continue to be called unchanged.","validation":"Construct an undiscovered manager whose discovery sweep installs hook and middleware callbacks; assert invocation and presence checks make it discovered and observe the callbacks, then assert a lifecycle-less stub manager remains usable.","parameters":["manager provider","background discovery join operation","discovery operation","callback kind","callback name","callback arguments"],"evidence_ids":["ev-impl-01","ev-impl-02","ev-callsite-01","ev-test-01"]}},{"name":"remove-unowned-legacy-registrations-on-full-unload","title":"Remove legacy global registrations during full unload","description":"Reconcile manager-local legacy registration tracking with the global registry while preserving entries whose teardown and restoration are controlled by ownership records.","evidence_ids":["ev-before-02","ev-impl-03","ev-test-02"],"semantic_action":{"intent":"Prevent stale extension-provided capabilities from surviving a full unload or force reload in a long-lived process.","module_role":"extension registration